{
  "format": 1,
  "id": "snowman",
  "title": "雪人",
  "description": "三个雪球叠起来，戴黑礼帽、围红围巾，胡萝卜鼻子，两根树枝当手。适合第一次拼：零件大、颜色少。",
  "author": {"name":"voxbrick"},
  "license": "CC0-1.0",
  "unit": "brick",
  "palette": {"K":"black","N":"brown","O":"orange","R":"red","W":"white"},
  "sections": [
    {"from":0,"to":7,"name":"底下的大雪球"},
    {"from":8,"to":13,"name":"中间的雪球、纽扣和树枝手"},
    {"from":14,"to":17,"name":"围巾和头"},
    {"from":18,"to":20,"name":"礼帽"}
  ],
  "layers": [
    [
      ".............",
      ".............",
      "......W......",
      "....WWWWW....",
      "....WWWWW....",
      "...WWWWWWW...",
      "....WWWWW....",
      "....WWWWW....",
      "......W......",
      ".............",
      "............."
    ],
    [
      ".............",
      ".....WWW.....",
      "...WWWWWWW...",
      "...WWWWWWW...",
      "..WWWWWWWWW..",
      "..WWWWWWWWW..",
      "..WWWWWWWWW..",
      "...WWWWWWW...",
      "...WWWWWWW...",
      ".....WWW.....",
      "............."
    ],
    [
      ".............",
      "....WWWWW....",
      "...WWWWWWW...",
      "..WWWWWWWWW..",
      "..WWWWWWWWW..",
      "..WWWWWWWWW..",
      "..WWWWWWWWW..",
      "..WWWWWWWWW..",
      "...WWWWWWW...",
      "....WWWWW....",
      "............."
    ],
    [
      ".....WWW.....",
      "...WWWWWWW...",
      "..WWWWWWWWW..",
      "..WWWWWWWWW..",
      ".WWWWWWWWWWW.",
      ".WWWWWWWWWWW.",
      ".WWWWWWWWWWW.",
      "..WWWWWWWWW..",
      "..WWWWWWWWW..",
      "...WWWWWWW...",
      ".....WWW....."
    ],
    [
      ".....WWW.....",
      "...WWWWWWW...",
      "..WWWWWWWWW..",
      "..WWWWWWWWW..",
      ".WWWWWWWWWWW.",
      ".WWWWWWWWWWW.",
      ".WWWWWWWWWWW.",
      "..WWWWWWWWW..",
      "..WWWWWWWWW..",
      "...WWWWWWW...",
      ".....WWW....."
    ],
    [
      ".............",
      "....WWWWW....",
      "...WWWWWWW...",
      "..WWWWWWWWW..",
      "..WWWWWWWWW..",
      "..WWWWWWWWW..",
      "..WWWWWWWWW..",
      "..WWWWWWWWW..",
      "...WWWWWWW...",
      "....WWWWW....",
      "............."
    ],
    [
      ".............",
      ".....WWW.....",
      "...WWWWWWW...",
      "...WWWWWWW...",
      "..WWWWWWWWW..",
      "..WWWWWWWWW..",
      "..WWWWWWWWW..",
      "...WWWWWWW...",
      "...WWWWWWW...",
      ".....WWW.....",
      "............."
    ],
    [
      ".............",
      ".............",
      "......W......",
      "....WWWWW....",
      "....WWWWW....",
      "...WWWWWWW...",
      "....WWWWW....",
      "....WWWWW....",
      "......W......",
      ".............",
      "............."
    ],
    [
      ".............",
      ".............",
      ".............",
      "....WWWWW....",
      "....WWWWW....",
      "....WWWWW....",
      "....WWWWW....",
      "....WWWWW....",
      ".............",
      ".............",
      "............."
    ],
    [
      ".............",
      ".............",
      "....WWWWW....",
      "...WWWWWWW...",
      "...WWWWWWW...",
      "...WWWWWWW...",
      "...WWWWWWW...",
      "...WWWWWWW...",
      "....WWKWW....",
      ".............",
      "............."
    ],
    [
      ".............",
      ".............",
      "....WWWWW....",
      "...WWWWWWW...",
      "...WWWWWWW...",
      "...WWWWWWW...",
      "...WWWWWWW...",
      "...WWWWWWW...",
      "....WWWWW....",
      ".............",
      "............."
    ],
    [
      ".............",
      ".............",
      "....WWWWW....",
      "...WWWWWWW...",
      "...WWWWWWW...",
      ".NNNWWWWWNNN.",
      "...WWWWWWW...",
      "...WWWWWWW...",
      "....WWKWW....",
      ".............",
      "............."
    ],
    [
      ".............",
      ".............",
      ".....WWW.....",
      "....WWWWW....",
      "...WWWWWWW...",
      "NN.WWWWWWW.NN",
      "...WWWWWWW...",
      "....WWWWW....",
      ".....WWR.....",
      ".............",
      "............."
    ],
    [
      ".............",
      ".............",
      ".............",
      ".............",
      ".....WWW.....",
      ".....WWW.....",
      ".....WWW.....",
      ".......R.....",
      ".............",
      ".............",
      "............."
    ],
    [
      ".............",
      ".............",
      ".....RRR.....",
      "....RRRRR....",
      "...RRRRRRR...",
      "...RRRRRRR...",
      "...RRRRRRR...",
      "....RRRRR....",
      ".....RRR.....",
      ".............",
      "............."
    ],
    [
      ".............",
      ".............",
      ".............",
      "....WWWWW....",
      "....WWWWW....",
      "....WWWWW....",
      "....WWWWW....",
      "....WWWWW....",
      ".............",
      ".............",
      "............."
    ],
    [
      ".............",
      ".............",
      "......W......",
      "....WWWWW....",
      "....WWWWW....",
      "...WWWWWWW...",
      "....WWWWW....",
      "....WWWWW....",
      "......O......",
      "......O......",
      "......O......"
    ],
    [
      ".............",
      ".............",
      ".............",
      ".....WWW.....",
      "....WWWWW....",
      "....WWWWW....",
      "....WWWWW....",
      ".....KWK.....",
      ".............",
      ".............",
      "............."
    ],
    [
      ".............",
      ".............",
      "......K......",
      "....KKKKK....",
      "....KKKKK....",
      "...KKKKKKK...",
      "....KKKKK....",
      "....KKKKK....",
      "......K......",
      ".............",
      "............."
    ],
    [
      ".............",
      ".............",
      ".............",
      ".....RRR.....",
      "....RRRRR....",
      "....RRRRR....",
      "....RRRRR....",
      ".....RRR.....",
      ".............",
      ".............",
      "............."
    ],
    [
      ".............",
      ".............",
      ".............",
      ".....KKK.....",
      "....KKKKK....",
      "....KKKKK....",
      "....KKKKK....",
      ".....KKK.....",
      ".............",
      ".............",
      "............."
    ]
  ]
}
