{
  "format": 1,
  "id": "robot",
  "title": "小机器人",
  "description": "方头方身体的小机器人：护目镜一样的黑色面罩和两只蓝眼睛，胸口屏幕上红黄绿三个指示灯，头顶一根天线，两只手垂在身体两侧。",
  "author": {"name":"voxbrick"},
  "license": "CC0-1.0",
  "unit": "brick",
  "palette": {"G":"green","K":"black","R":"red","Y":"yellow","b":"lightBlue","d":"darkGray","l":"lightGray","u":"darkBlue"},
  "sections": [
    {"from":0,"to":0,"name":"脚"},
    {"from":1,"to":3,"name":"腿"},
    {"from":4,"to":9,"name":"身体、屏幕和手臂"},
    {"from":10,"to":10,"name":"脖子"},
    {"from":11,"to":14,"name":"头和面罩"},
    {"from":15,"to":17,"name":"天线"}
  ],
  "layers": [
    [
      "..dddd..dddd..",
      "..dddd..dddd..",
      "..dddd..dddd..",
      "..dddd..dddd..",
      "..dddd..dddd..",
      "..dddd..dddd..",
      "..dddd..dddd.."
    ],
    [
      "..............",
      "..............",
      "...ll....ll...",
      "...ll....ll...",
      "...ll....ll...",
      "..............",
      ".............."
    ],
    [
      "..............",
      "..............",
      "...ll....ll...",
      "...ll....ll...",
      "...ll....ll...",
      "..............",
      ".............."
    ],
    [
      "..............",
      "..............",
      "...ll....ll...",
      "...ll....ll...",
      "...ll....ll...",
      "..............",
      ".............."
    ],
    [
      "..llllllllll..",
      "..llllllllll..",
      "YYllllllllllYY",
      "YYllllllllllYY",
      "YYllllllllllYY",
      "..llllllllll..",
      "..llllllllll.."
    ],
    [
      "..llllllllll..",
      "..llllllllll..",
      "ddlllllllllldd",
      "ddlllllllllldd",
      "ddlllllllllldd",
      "..llllllllll..",
      "..lluuuuuull.."
    ],
    [
      "..llllllllll..",
      "..llllllllll..",
      "ddlllllllllldd",
      "ddlllllllllldd",
      "ddlllllllllldd",
      "..llllllllll..",
      "..lluuuuuull.."
    ],
    [
      "..llllllllll..",
      "..llllllllll..",
      "ddlllllllllldd",
      "ddlllllllllldd",
      "ddlllllllllldd",
      "..llllllllll..",
      "..lluRuYuGll.."
    ],
    [
      "..llllllllll..",
      "..llllllllll..",
      "ddlllllllllldd",
      "ddlllllllllldd",
      "ddlllllllllldd",
      "..llllllllll..",
      "..lluuuuuull.."
    ],
    [
      "..llllllllll..",
      "dddddddddddddd",
      "dddddddddddddd",
      "dddddddddddddd",
      "dddddddddddddd",
      "dddddddddddddd",
      "..llllllllll.."
    ],
    [
      "..............",
      "..............",
      "......dd......",
      "......dd......",
      "..............",
      "..............",
      ".............."
    ],
    [
      "...llllllll...",
      "...llllllll...",
      "...llllllll...",
      "...llllllll...",
      "...llllllll...",
      "...llddddll...",
      ".............."
    ],
    [
      "...llllllll...",
      "...llllllll...",
      "..RllllllllR..",
      "..RllllllllR..",
      "...llllllll...",
      "...lKbKKbKl...",
      ".............."
    ],
    [
      "...llllllll...",
      "...llllllll...",
      "..RllllllllR..",
      "..RllllllllR..",
      "...llllllll...",
      "...lKbKKbKl...",
      ".............."
    ],
    [
      "...llllllll...",
      "...llllllll...",
      "...llllllll...",
      "...llllllll...",
      "...llllllll...",
      "...llllllll...",
      ".............."
    ],
    [
      "..............",
      "..............",
      "......dd......",
      "......dd......",
      "..............",
      "..............",
      ".............."
    ],
    [
      "..............",
      "..............",
      "......dd......",
      "......dd......",
      "..............",
      "..............",
      ".............."
    ],
    [
      "..............",
      "..............",
      "......RR......",
      "......RR......",
      "..............",
      "..............",
      ".............."
    ]
  ]
}
